{
  "domain": "race-rural-settlement",
  "version": 2,
  "sample_id": "record-004",
  "event": "略阳越野赛",
  "actors": [
    "县域赛事运营方",
    "本地农产品商户",
    "文旅服务商",
    "游客与参赛者",
    "补贴资金管理人员（财政）",
    "主办单位"
  ],
  "facts": [
    "赛事现场设置特色农产品展销区，农产品按批次上架销售",
    "消费券既可用于购买农产品，也可抵扣文旅套餐款项",
    "活动通过消费券和旅游路线推介连接在地产业",
    "主办方希望形成体育、农业和文旅融合路径",
    "赛事期间可能发生选手退赛、暴雨等极端天气迫使活动缩短、商户临时更换摊位",
    "优惠由谁承担、退款退向何处必须当场可查可结算，不能依赖活动结束后的表格补算",
    "同一张消费券可能在多台终端被同时出示，手机截图可能被反复出示",
    "一笔订单可能被拆分为多笔结算，文旅套餐可能只履约一部分并发生部分退款",
    "消费券资金来自财政补贴等不同出资批次，每笔优惠必须能指回承担方"
  ],
  "constraints": [
    "商户入驻与摊位（含临时变更）登记",
    "消费券发放与适用范围维护",
    "现场消费券核销（农产品与文旅套餐）",
    "农产品批次与交易留痕",
    "订单拆分与补贴分摊",
    "文旅套餐履约登记",
    "全额与部分退款及补贴回收",
    "补贴资金分户台账对账",
    "新增销售与赛后复购成效核对"
  ],
  "ledger_chain": [
    {
      "id": "registration",
      "name": "参赛登记",
      "desc": "参赛人以匿名或哈希标识登记并关联报名号，链路中不落真实证件信息"
    },
    {
      "id": "voucher",
      "name": "消费券",
      "desc": "唯一券号、面额、出资批次（财政/主办/联合出资），登记适用范围：可用农产品品类、文旅套餐、商户名单与有效期"
    },
    {
      "id": "merchant_stall",
      "name": "商户与摊位",
      "desc": "交易归属商户主体而非物理摊位；摊位占用按时段登记，临时换摊保留起止时间"
    },
    {
      "id": "product_batch",
      "name": "商品批次",
      "desc": "农产品按批次上架，订单行记录批次号，支撑质量溯源与赛期/非赛期基线对比"
    },
    {
      "id": "order",
      "name": "订单与拆单",
      "desc": "拆分子单以 parent_order_id 挂接原单，券抵扣按行项分摊，全部子单分摊之和等于原抵扣额"
    },
    {
      "id": "payment",
      "name": "支付",
      "desc": "渠道流水区分游客自付金额与消费券抵扣金额，退款可按原路径返回"
    },
    {
      "id": "redemption",
      "name": "核销凭证",
      "desc": "服务端签发并签名，记录券号、订单号、商户、摊位、批次、金额与时间；一张券对应唯一一条核销记录，核销请求幂等"
    },
    {
      "id": "tourism_service",
      "name": "文旅服务",
      "desc": "套餐订单记录服务日期与履约状态：未履约、部分履约、已履约；已收款与已履约分别记账"
    },
    {
      "id": "refund",
      "name": "退款",
      "desc": "游客自付部分原路退回支付渠道，券抵扣部分退回补贴资金池、不以现金退给游客；全额或部分退款均回写原核销凭证"
    },
    {
      "id": "subsidy_ledger",
      "name": "补贴资金台账",
      "desc": "按出资批次分户登记预付、实付、回收与余额，每笔优惠和每笔回收对应唯一台账分录"
    }
  ],
  "scenarios": [
    {
      "id": "runner_withdraw",
      "name": "选手退赛",
      "trigger": "选手赛前或赛中放弃参赛",
      "rule": "已交付取货的农产品交易保持有效；未使用的消费券在适用范围与有效期内仍可使用，或按发券规则收回；已购文旅套餐中未履约部分，游客自付款原路退回，券抵扣额退回补贴资金池",
      "bearer": "未履约服务对应的优惠不由商户承担；补贴回收后该券额度注销，不得对同一服务再次计补"
    },
    {
      "id": "weather_shortened",
      "name": "暴雨迫使活动缩短",
      "trigger": "极端天气导致赛事或文旅行程提前终止",
      "rule": "文旅服务按已履约与未履约拆分结算；已收款未履约订单批量进入退款队列，逐单列示退款去向（原路退回多少、补贴池回收多少）；已交付的农产品交易不受影响",
      "bearer": "不可抗力情形下券面优惠按出资批次由对应资金承担并回收，不要求商户倒贴；缩短不改变一券一核销，禁止重发券重复补贴"
    },
    {
      "id": "stall_change",
      "name": "商户临时换摊",
      "trigger": "商户在活动期间被调整到其他摊位",
      "rule": "交易归属商户主体，换摊只登记摊位时段变更；历史核销凭证按成交时的摊位快照留档，已享优惠与退款路径不因换摊改变",
      "bearer": "换摊不产生新补贴也不产生二次补贴，商户只在本商户账户内看到新旧摊位上的本户交易"
    }
  ],
  "controls": [
    {
      "id": "server_side_credential",
      "rule": "核销只认服务端签发的凭证：手机截图、拍照、客户端页面展示均不构成核销依据，凭证须含券号、订单号、商户、批次、金额、时间与服务端签名"
    },
    {
      "id": "single_redemption_concurrency",
      "rule": "券号唯一约束配合状态机（未用/锁定/已核销/部分退款/已退回），核销使用条件更新或行锁；多终端并发出示同券时仅一笔成功，其余返回该券已核销状态"
    },
    {
      "id": "idempotent_request",
      "rule": "核销与退款请求携带幂等键，网络重试或重复提交返回同一凭证、同一结果，不重复扣减补贴"
    },
    {
      "id": "split_allocation",
      "rule": "订单拆分时券抵扣在订单行项或子单间写明分摊金额，全部子单分摊之和等于原券抵扣额，任何子单退款不影响其他子单已享补贴"
    },
    {
      "id": "partial_refund_clawback",
      "rule": "部分退款按比例回收补贴（退款补贴 = 退款金额 × 该单补贴 / 订单总额），累计回收不得超过该凭证已核销补贴，回收与退款一并回写原凭证"
    },
    {
      "id": "refund_links_credential",
      "rule": "退款、撤销、冲正必须关联原核销凭证号；禁止以新券补偿旧单，补发新券一律走新凭证并单独计补"
    },
    {
      "id": "stall_snapshot",
      "rule": "成交记录固化商户主体、摊位号与摊位时段快照，临时换摊不改旧账、不补差价、不重开凭证"
    },
    {
      "id": "ledger_invariant",
      "rule": "补贴台账分户守恒：余额 = 预付 − 已核销实付 + 已回收；每笔优惠对应唯一台账分录，每笔回收反向冲减原分录"
    }
  ],
  "access_rules": [
    {
      "id": "visitor_on_site_query",
      "rule": "游客在现场扫码即可查清券的适用范围（可用商户、农产品品类、文旅套餐、有效期）和每笔订单的退款去向：自付退多少、补贴退回多少、分别退到何处"
    },
    {
      "id": "merchant_isolation",
      "rule": "商户经服务端授权后只能访问和操作本 merchant_id 的订单、核销与退款；其他商户的交易在接口鉴权层直接拒绝，而不是靠前端页面隐藏"
    },
    {
      "id": "finance_readonly",
      "rule": "财政资金管理人员与主办单位对全链路拥有只读权限，按出资批次取得对账分录与汇总报表，不直接执行核销或退款"
    },
    {
      "id": "pseudonymous_data",
      "rule": "参赛人、游客、复购顾客全程使用化名或哈希标识，样例与仓库不落真实姓名、证件号、手机号"
    }
  ],
  "reports": [
    {
      "id": "discount_bearing",
      "question": "每笔优惠由谁承担",
      "basis": "核销凭证关联消费券出资批次与补贴台账分录，逐笔订单输出优惠金额与承担方（财政、主办或联合出资比例）；退单与补贴回收按同一口径冲减"
    },
    {
      "id": "incremental_sales",
      "question": "赛事究竟带来了多少新增销售",
      "basis": "赛期 event_id 关联订单（农产品现场销售与文旅下单分列）对照非赛期同口径商户/批次基线，自付金额与含券金额分别统计，避免把补贴混同为销售收入"
    },
    {
      "id": "repeat_purchase",
      "question": "赛后产生了多少后续复购",
      "basis": "以匿名标识追踪赛后窗口期同一顾客的再次购买（线上店铺或复购活动），单列复购人数、复购率与复购金额，不重复计入赛期新增销售"
    },
    {
      "id": "paid_unfulfilled_tourism",
      "question": "哪些已收款的旅游服务尚未履约",
      "basis": "筛选文旅订单中已收款且履约状态不为已履约的记录，按服务商、套餐、服务日期汇总笔数与金额，并标注应原路退回与应回补补贴池的金额；活动缩短时即为退款队列"
    }
  ]
}
